{
    "$schema": "http://json-schema.org/draft-07/schema#",
    "additionalProperties": false,
    "definitions": {
        "I18nData": {
            "additionalProperties": {
                "items": {
                    "type": "string"
                },
                "type": "array"
            },
            "description": "Label object for multilingual strings",
            "type": "object"
        },
        "WorkTypes.CreatedData": {
            "additionalProperties": false,
            "properties": {
                "label": {
                    "$ref": "#/definitions/I18nData"
                },
                "value": {
                    "type": "string"
                }
            },
            "type": "object"
        },
        "WorkTypes.CreatorData": {
            "additionalProperties": false,
            "properties": {
                "relatedTo": {
                    "$ref": "#/definitions/WorkTypes.RelatedToData"
                },
                "role": {
                    "$ref": "#/definitions/WorkTypes.RoleData"
                }
            },
            "type": "object"
        },
        "WorkTypes.EncodingsData": {
            "additionalProperties": false,
            "properties": {
                "data": {
                    "$ref": "#/definitions/WorkTypes.PAEData"
                },
                "format": {
                    "type": "string"
                },
                "label": {
                    "$ref": "#/definitions/I18nData"
                },
                "url": {
                    "type": "string"
                }
            },
            "type": "object"
        },
        "WorkTypes.ExternalAuthoritiesData": {
            "additionalProperties": false,
            "properties": {
                "items": {
                    "items": {
                        "$ref": "#/definitions/WorkTypes.ExternalAuthoritiesItemData"
                    },
                    "type": "array"
                },
                "label": {
                    "$ref": "#/definitions/I18nData"
                },
                "type": {
                    "type": "string"
                }
            },
            "required": [
                "items"
            ],
            "type": "object"
        },
        "WorkTypes.ExternalAuthoritiesItemData": {
            "additionalProperties": false,
            "properties": {
                "base": {
                    "type": "string"
                },
                "label": {
                    "$ref": "#/definitions/I18nData"
                },
                "type": {
                    "type": "string"
                },
                "url": {
                    "type": "string"
                },
                "value": {
                    "type": "string"
                }
            },
            "type": "object"
        },
        "WorkTypes.FormOfWorkData": {
            "additionalProperties": false,
            "properties": {
                "items": {
                    "items": {
                        "$ref": "#/definitions/WorkTypes.FormOfWorkItemData"
                    },
                    "type": "array"
                },
                "sectionLabel": {
                    "$ref": "#/definitions/I18nData"
                },
                "type": {
                    "type": "string"
                }
            },
            "required": [
                "items"
            ],
            "type": "object"
        },
        "WorkTypes.FormOfWorkItemData": {
            "additionalProperties": false,
            "properties": {
                "id": {
                    "type": "string"
                },
                "label": {
                    "$ref": "#/definitions/I18nData"
                },
                "type": {
                    "type": "string"
                },
                "value": {
                    "type": "string"
                }
            },
            "type": "object"
        },
        "WorkTypes.IncipitSummaryData": {
            "additionalProperties": false,
            "properties": {
                "label": {
                    "$ref": "#/definitions/I18nData"
                },
                "value": {
                    "$ref": "#/definitions/I18nData"
                }
            },
            "type": "object"
        },
        "WorkTypes.IncipitsData": {
            "additionalProperties": false,
            "properties": {
                "id": {
                    "type": "string"
                },
                "items": {
                    "items": {
                        "$ref": "#/definitions/WorkTypes.IncipitsItemData"
                    },
                    "type": "array"
                },
                "sectionLabel": {
                    "$ref": "#/definitions/I18nData"
                },
                "type": {
                    "type": "string"
                }
            },
            "type": "object"
        },
        "WorkTypes.IncipitsItemData": {
            "additionalProperties": false,
            "properties": {
                "encodings": {
                    "items": {
                        "$ref": "#/definitions/WorkTypes.EncodingsData"
                    },
                    "type": "array"
                },
                "id": {
                    "type": "string"
                },
                "label": {
                    "$ref": "#/definitions/I18nData"
                },
                "properties": {
                    "$ref": "#/definitions/WorkTypes.PropertiesData"
                },
                "rendered": {
                    "items": {
                        "$ref": "#/definitions/WorkTypes.RenderedData"
                    },
                    "type": "array"
                },
                "sectionLabel": {
                    "$ref": "#/definitions/I18nData"
                },
                "summary": {
                    "items": {
                        "$ref": "#/definitions/WorkTypes.IncipitSummaryData"
                    },
                    "type": "array"
                },
                "type": {
                    "type": "string"
                }
            },
            "required": [
                "id"
            ],
            "type": "object"
        },
        "WorkTypes.ItemsData": {
            "additionalProperties": false,
            "properties": {
                "relatedTo": {
                    "$ref": "#/definitions/WorkTypes.RelatedToData"
                },
                "relationshipType": {
                    "type": "string"
                },
                "workNumber": {
                    "type": "string"
                }
            },
            "type": "object"
        },
        "WorkTypes.PAEData": {
            "additionalProperties": false,
            "properties": {
                "clef": {
                    "type": "string"
                },
                "data": {
                    "type": "string"
                },
                "key": {
                    "type": "string"
                },
                "keysig": {
                    "type": "string"
                },
                "timesig": {
                    "type": "string"
                }
            },
            "type": "object"
        },
        "WorkTypes.PartOfData": {
            "additionalProperties": false,
            "properties": {
                "items": {
                    "items": {
                        "$ref": "#/definitions/WorkTypes.ItemsData"
                    },
                    "type": "array"
                },
                "label": {
                    "$ref": "#/definitions/I18nData"
                },
                "type": {
                    "type": "string"
                }
            },
            "type": "object"
        },
        "WorkTypes.PropertiesData": {
            "additionalProperties": false,
            "properties": {
                "clef": {
                    "type": "string"
                },
                "keysig": {
                    "type": "string"
                },
                "notation": {
                    "type": "string"
                },
                "timesig": {
                    "type": "string"
                }
            },
            "type": "object"
        },
        "WorkTypes.RecordHistoryData": {
            "additionalProperties": false,
            "properties": {
                "created": {
                    "$ref": "#/definitions/WorkTypes.CreatedData"
                },
                "type": {
                    "type": "string"
                },
                "updated": {
                    "$ref": "#/definitions/WorkTypes.UpdatedData"
                }
            },
            "type": "object"
        },
        "WorkTypes.RelatedToData": {
            "additionalProperties": false,
            "properties": {
                "id": {
                    "type": "string"
                },
                "label": {
                    "$ref": "#/definitions/I18nData"
                },
                "status": {
                    "$ref": "#/definitions/WorkTypes.StatusData"
                },
                "type": {
                    "type": "string"
                },
                "typeLabel": {
                    "$ref": "#/definitions/I18nData"
                }
            },
            "required": [
                "id",
                "label"
            ],
            "type": "object"
        },
        "WorkTypes.RelationshipsData": {
            "additionalProperties": false,
            "properties": {
                "items": {
                    "items": {
                        "$ref": "#/definitions/WorkTypes.RelationshipsItemData"
                    },
                    "type": "array"
                },
                "sectionLabel": {
                    "$ref": "#/definitions/I18nData"
                }
            },
            "type": "object"
        },
        "WorkTypes.RelationshipsItemData": {
            "additionalProperties": false,
            "properties": {
                "relatedTo": {
                    "$ref": "#/definitions/WorkTypes.RelatedToData"
                },
                "role": {
                    "$ref": "#/definitions/WorkTypes.RoleData"
                }
            },
            "type": "object"
        },
        "WorkTypes.RenderedData": {
            "additionalProperties": false,
            "properties": {
                "data": {
                    "type": "string"
                },
                "format": {
                    "type": "string"
                },
                "url": {
                    "type": "string"
                }
            },
            "type": "object"
        },
        "WorkTypes.RoleData": {
            "additionalProperties": false,
            "properties": {
                "id": {
                    "type": "string"
                },
                "label": {
                    "$ref": "#/definitions/I18nData"
                },
                "value": {
                    "type": "string"
                }
            },
            "type": "object"
        },
        "WorkTypes.SourcesData": {
            "additionalProperties": false,
            "properties": {
                "totalItems": {
                    "type": "number"
                },
                "url": {
                    "type": "string"
                }
            },
            "type": "object"
        },
        "WorkTypes.StatusData": {
            "additionalProperties": false,
            "properties": {
                "label": {
                    "$ref": "#/definitions/I18nData"
                },
                "value": {
                    "type": "string"
                }
            },
            "type": "object"
        },
        "WorkTypes.SummaryData": {
            "additionalProperties": false,
            "properties": {
                "label": {
                    "$ref": "#/definitions/I18nData"
                },
                "value": {
                    "$ref": "#/definitions/I18nData"
                }
            },
            "type": "object"
        },
        "WorkTypes.UpdatedData": {
            "additionalProperties": false,
            "properties": {
                "label": {
                    "$ref": "#/definitions/I18nData"
                },
                "value": {
                    "type": "string"
                }
            },
            "type": "object"
        }
    },
    "properties": {
        "@context": {
            "type": "string"
        },
        "creator": {
            "$ref": "#/definitions/WorkTypes.CreatorData"
        },
        "externalAuthorities": {
            "$ref": "#/definitions/WorkTypes.ExternalAuthoritiesData"
        },
        "formOfWork": {
            "$ref": "#/definitions/WorkTypes.FormOfWorkData"
        },
        "id": {
            "type": "string"
        },
        "incipits": {
            "$ref": "#/definitions/WorkTypes.IncipitsData"
        },
        "label": {
            "$ref": "#/definitions/I18nData"
        },
        "partOf": {
            "$ref": "#/definitions/WorkTypes.PartOfData"
        },
        "recordHistory": {
            "$ref": "#/definitions/WorkTypes.RecordHistoryData"
        },
        "relationships": {
            "$ref": "#/definitions/WorkTypes.RelationshipsData"
        },
        "sources": {
            "$ref": "#/definitions/WorkTypes.SourcesData"
        },
        "summary": {
            "items": {
                "$ref": "#/definitions/WorkTypes.SummaryData"
            },
            "type": "array"
        },
        "type": {
            "type": "string"
        }
    },
    "required": [
        "id",
        "partOf"
    ],
    "type": "object"
}

