{
  "@context": "https://dev.rism.online/api/v1/work.json",
  "id": "https://dev.rism.online/works/32206",
  "type": "rism:Work",
  "label": {
    "none": [
      "Verleih uns Frieden  MWV A 11"
    ]
  },
  "creator": {
    "role": {
      "label": {
        "pl": [
          "Kompozytor / Autor"
        ],
        "en": [
          "Composer/Author"
        ],
        "it": [
          "Compositore/Autore"
        ],
        "fr": [
          "Compositeur/Auteur"
        ],
        "pt": [
          "Compositor/Autor"
        ],
        "de": [
          "Komponist/Autor"
        ],
        "es": [
          "Compositor/Autor"
        ]
      },
      "value": "relators:cre",
      "id": "relators:cre"
    },
    "relatedTo": {
      "id": "https://dev.rism.online/people/88790",
      "label": {
        "none": [
          "Mendelssohn Bartholdy, Felix (1809-1847)"
        ]
      },
      "type": "rism:Person"
    }
  },
  "summary": [
    {
      "label": {
        "pl": [
          "Tonacja lub modus"
        ],
        "en": [
          "Key or mode"
        ],
        "it": [
          "Tonalità, modo"
        ],
        "fr": [
          "Tonalité, mode"
        ],
        "pt": [
          "Tonalidade, modo"
        ],
        "de": [
          "Tonart, Modus"
        ],
        "es": [
          "Tonalidad o modo"
        ]
      },
      "value": {
        "pl": [
          "Es-dur"
        ],
        "en": [
          "E♭ major"
        ],
        "it": [
          "Mi♭ maggiore"
        ],
        "fr": [
          "Mi♭ majeur"
        ],
        "pt": [
          "Mi bemol maior"
        ],
        "de": [
          "Es-Dur"
        ],
        "es": [
          "Mi bemol Mayor"
        ]
      }
    },
    {
      "label": {
        "pl": [
          "Podsumowanie obsady"
        ],
        "en": [
          "Scoring summary"
        ],
        "it": [
          "Organico sintetico"
        ],
        "fr": [
          "Instrumentation condensée"
        ],
        "pt": [
          "Sintese da formação instrumental"
        ],
        "de": [
          "Besetzungshinweis"
        ],
        "es": [
          "Resumen de Plantilla/Orgánico"
        ]
      },
      "value": {
        "none": [
          "V (4), orch"
        ]
      }
    },
    {
      "label": {
        "pl": [
          "Incipit tekstowy"
        ],
        "en": [
          "Text incipit"
        ],
        "it": [
          "Incipit testuale"
        ],
        "fr": [
          "Incipit du texte"
        ],
        "pt": [
          "Incipit literário"
        ],
        "de": [
          "Textincipit"
        ],
        "es": [
          "Íncipit literario"
        ]
      },
      "value": {
        "none": [
          "Verleih uns Frieden gnädiglich"
        ]
      }
    },
    {
      "label": {
        "pl": [
          "Alternatywny tytuł dzieła"
        ],
        "en": [
          "Alternative work title"
        ],
        "it": [
          "Titolo alternativo dell'opera"
        ],
        "fr": [
          "Titre alternatif"
        ],
        "pt": [
          "Título alternativo da obra"
        ],
        "de": [
          "Alternativer Werktitel"
        ],
        "es": [
          "Título alternativo"
        ]
      },
      "value": {
        "pl": [
          "Choral / Gebet „Verleih uns Frieden“ / „Da nobis pacem, Domine“",
          "Da nobis pacem Domine",
          "O salutaris hostia",
          "Gebet",
          "Verleih uns Frieden",
          "Da nobis pacem",
          "Gebet nach Luther'schen Worten",
          "Dona nobis pacem Domine"
        ],
        "en": [
          "Choral / Gebet „Verleih uns Frieden“ / „Da nobis pacem, Domine“",
          "Da nobis pacem Domine",
          "O salutaris hostia",
          "Gebet",
          "Verleih uns Frieden",
          "Da nobis pacem",
          "Gebet nach Luther'schen Worten",
          "Dona nobis pacem Domine"
        ],
        "it": [
          "Choral / Gebet „Verleih uns Frieden“ / „Da nobis pacem, Domine“",
          "Da nobis pacem Domine",
          "O salutaris hostia",
          "Gebet",
          "Verleih uns Frieden",
          "Da nobis pacem",
          "Gebet nach Luther'schen Worten",
          "Dona nobis pacem Domine"
        ],
        "fr": [
          "Choral / Gebet „Verleih uns Frieden“ / „Da nobis pacem, Domine“",
          "Da nobis pacem Domine",
          "O salutaris hostia",
          "Gebet",
          "Verleih uns Frieden",
          "Da nobis pacem",
          "Gebet nach Luther'schen Worten",
          "Dona nobis pacem Domine"
        ],
        "pt": [
          "Choral / Gebet „Verleih uns Frieden“ / „Da nobis pacem, Domine“",
          "Da nobis pacem Domine",
          "O salutaris hostia",
          "Gebet",
          "Verleih uns Frieden",
          "Da nobis pacem",
          "Gebet nach Luther'schen Worten",
          "Dona nobis pacem Domine"
        ],
        "de": [
          "Choral / Gebet „Verleih uns Frieden“ / „Da nobis pacem, Domine“",
          "Da nobis pacem Domine",
          "O salutaris hostia",
          "Gebet",
          "Verleih uns Frieden",
          "Da nobis pacem",
          "Gebet nach Luther'schen Worten",
          "Dona nobis pacem Domine"
        ],
        "es": [
          "Choral / Gebet „Verleih uns Frieden“ / „Da nobis pacem, Domine“",
          "Da nobis pacem Domine",
          "O salutaris hostia",
          "Gebet",
          "Verleih uns Frieden",
          "Da nobis pacem",
          "Gebet nach Luther'schen Worten",
          "Dona nobis pacem Domine"
        ]
      }
    },
    {
      "label": {
        "pl": [
          "Daty"
        ],
        "en": [
          "Dates"
        ],
        "it": [
          "Date"
        ],
        "fr": [
          "Dates"
        ],
        "pt": [
          "Datas"
        ],
        "de": [
          "Datierungen"
        ],
        "es": [
          "Fechas"
        ]
      },
      "value": {
        "none": [
          "1831 (10. Februar 1831)"
        ]
      }
    },
    {
      "label": {
        "pl": [
          "RISM ID"
        ],
        "en": [
          "RISM ID number"
        ],
        "it": [
          "Numero documento RISM"
        ],
        "fr": [
          "No. RISM"
        ],
        "pt": [
          "Número ID RISM"
        ],
        "de": [
          "RISM Dokumentnummer"
        ],
        "es": [
          "Número de ID de RISM"
        ]
      },
      "value": {
        "none": [
          "works/32206"
        ]
      }
    }
  ],
  "partOf": {
    "label": {
      "pl": [
        "Jest częścią…"
      ],
      "en": [
        "Item part of"
      ],
      "it": [
        "Fa parte di"
      ],
      "fr": [
        "Fait partie de"
      ],
      "pt": [
        "Item parte de"
      ],
      "de": [
        "In"
      ],
      "es": [
        "Ítem integrante de"
      ]
    },
    "type": "rism:PartOfSection",
    "items": [
      {
        "relationshipType": "rism:PrimaryPartOf",
        "relatedTo": {
          "id": "https://dev.rism.online/publications/30025296",
          "label": {
            "none": [
              "Felix Mendelssohn Bartholdy - thematisch-systematisches Verzeichnis der musikalischen Werke (MWV)"
            ]
          },
          "type": "rism:Publication",
          "typeLabel": {
            "pl": [
              "Katalog dzieł"
            ],
            "en": [
              "Work catalog"
            ],
            "it": [
              "Catalogo delle opere"
            ],
            "fr": [
              "Catalogue des œuvres"
            ],
            "pt": [
              "Catálogo da obra"
            ],
            "de": [
              "Werkkatalog"
            ],
            "es": [
              "Catálogos de trabajo"
            ]
          },
          "status": {
            "label": {
              "pl": [
                "Kompletne"
              ],
              "en": [
                "Completed"
              ],
              "it": [
                "Completato"
              ],
              "fr": [
                "Terminé"
              ],
              "pt": [
                "Concluído"
              ],
              "de": [
                "Abgeschlossen"
              ],
              "es": [
                "Completado"
              ]
            },
            "value": "completed"
          }
        },
        "workNumber": "MWV A 11"
      }
    ]
  },
  "recordHistory": {
    "type": "rism:RecordHistory",
    "created": {
      "label": {
        "pl": [
          "Data utworzenia"
        ],
        "en": [
          "Created on"
        ],
        "it": [
          "Data di creazione"
        ],
        "fr": [
          "Date de création"
        ],
        "pt": [
          "Criado em"
        ],
        "de": [
          "Erstellungsdatum"
        ],
        "es": [
          "Fecha de creación"
        ]
      },
      "value": "2023-04-26T06:31:48Z"
    },
    "updated": {
      "label": {
        "pl": [
          "Ostatnia modyfikacja"
        ],
        "en": [
          "Last modification"
        ],
        "it": [
          "Ultima modifica"
        ],
        "fr": [
          "Dernière modification"
        ],
        "pt": [
          "Última modificação"
        ],
        "de": [
          "Letzte Änderung"
        ],
        "es": [
          "Fecha de modificación"
        ]
      },
      "value": "2025-09-08T11:23:45Z"
    }
  },
  "incipits": {
    "id": "https://dev.rism.online/works/32206/incipits",
    "sectionLabel": {
      "pl": [
        "Incipity"
      ],
      "en": [
        "Incipits"
      ],
      "it": [
        "Incipit"
      ],
      "fr": [
        "Incipits"
      ],
      "pt": [
        "Incipit"
      ],
      "de": [
        "Incipits"
      ],
      "es": [
        "Íncipits"
      ]
    },
    "type": "rism:WorkIncipitsSection",
    "items": [
      {